{
  "title": "Маленька історія про красу",
  "language": "uk",
  "age_range": "4-12",
  "moral": "Іноді потрібно зупинитися, щоб побачити красу",
  "duration_goal_sec": 40,
  "scenes": [
    {
      "id": "SC01",
      "summary": "Ліна літає швидко над галявиною, торкаючись квітів, але не помічає все довкола",
      "dialogue": [
        {
          "speaker": "grandpa",
          "text": "Метелиця Ліна народилась із сонячного промінчика і пелюстки фіалки."
        },
        {
          "speaker": "grandpa",
          "text": "Вона літала легко, ніби музика вітру, і торкалася пелюсток кожної квітки."
        }
      ],
      "characters": [
        "grandpa",
        "lina"
      ],
      "visual_notes": "Показати Ліну, що кружляє над квітами на яскравій галявині.",
      "beats": [
        {
          "t_rel": 0.0,
          "event": "Ліна з’являється",
          "emphasis": "intro"
        },
        {
          "t_rel": 4.0,
          "event": "кадрування на різнокольорові квіти"
        }
      ]
    },
    {
      "id": "SC02",
      "summary": "Ліна пролітає повз сірий кущик і говорить, що він негарний",
      "dialogue": [
        {
          "speaker": "grandpa",
          "text": "Одного разу вона пролетіла повз маленький кущик без кольору."
        },
        {
          "speaker": "lina",
          "text": "Фу, негарно!"
        }
      ],
      "characters": [
        "grandpa",
        "lina"
      ],
      "visual_notes": "Сірий кущик з закритим пуп’янком на тлі барвистої галявини.",
      "beats": [
        {
          "t_rel": 0.0,
          "event": "кадр на сірий кущ",
          "emphasis": "contrast"
        },
        {
          "t_rel": 3.0,
          "event": "Ліна пролітає"
        }
      ]
    },
    {
      "id": "SC03",
      "summary": "Жук Чмелик піклується про кущик, і він розквітає; Ліна повертається і вчиться бачити",
      "dialogue": [
        {
          "speaker": "grandpa",
          "text": "Жук Чмелик прийшов і прошепотів: \"Ти не страшний. Ти просто ще не розкрився.\""
        },
        {
          "speaker": "grandpa",
          "text": "Через кілька днів кущик розцвів, і Ліна сказала: \"Ого!\""
        },
        {
          "speaker": "grandpa",
          "text": "Відтоді Ліна іноді зупинялась і слухала, бо справжня краса відкривається тим, хто дивиться серцем."
        }
      ],
      "characters": [
        "grandpa",
        "lina",
        "chmelyk"
      ],
      "visual_notes": "Показати Чмелика, що сидить поруч із кущиком, потім квітка розквітає і Ліна захоплена.",
      "beats": [
        {
          "t_rel": 0.0,
          "event": "Чмелик приходить"
        },
        {
          "t_rel": 2.0,
          "event": "Кущ розквітає"
        },
        {
          "t_rel": 4.0,
          "event": "Ліна повертається"
        }
      ]
    }
  ]
}