{
  "title": "Метелиця Ліна і квітка, яку не бачив ніхто",
  "language": "uk",
  "age_range": "4-12",
  "moral": "Легкість – це чудово, але краса відкривається тим, хто зупиняється і дивиться серцем",
  "duration_goal_sec": 160,
  "scenes": [
    {
      "id": "SC01",
      "summary": "Народження Метелиці Ліни – поетичне походження з сонячного промінчика і пелюстки фіалки.",
      "dialogue": [
        {"speaker": "grandpa", "text": "Метелиця Ліна народилась із сонячного промінчика і пелюстки фіалки."},
        {"speaker": "grandpa", "text": "Вона літала легко, ніби музика вітру."}
      ],
      "characters": ["grandpa", "lina"],
      "visual_notes": "Ліна з’являється в ніжних тонах світла й фіалки, пливе у повітрі як музика.",
      "beats": [
        {"t_rel": 0.0, "event": "Світло та фіалка об’єднуються", "emphasis": "magical"},
        {"t_rel": 2.5, "event": "Ліна виникає"}
      ]
    },
    {
      "id": "SC02",
      "summary": "Ліна любить швидкість, пролітає галявини, торкається квітів і вірить, що встигне все.",
      "dialogue": [
        {"speaker": "grandpa", "text": "Ліна дуже любила швидкість: \"Я встигну все!\" – повторювала вона, пролітаючи галявини."},
        {"speaker": "grandpa", "text": "Але саме тому вона часто не помічала важливого."}
      ],
      "characters": ["grandpa", "lina"],
      "visual_notes": "Ліна пролітає над квітами; кадри пейзажу летять повз, слова \"Я встигну все!\" виглядають як текст у повітрі.",
      "beats": [
        {"t_rel": 0.0, "event": "Ліна прискорюється"},
        {"t_rel": 3.0, "event": "Пролітає барвисті галявини"},
        {"t_rel": 5.5, "event": "Вислів про швидкість"}
      ]
    },
    {
      "id": "SC03",
      "summary": "Ліна пролетіла повз маленький сірий кущик без кольору і назвала його негарним.",
      "dialogue": [
        {"speaker": "grandpa", "text": "Одного разу вона пролетіла повз маленький кущик без кольору."},
        {"speaker": "lina", "text": "Фу, негарно!"},
        {"speaker": "grandpa", "text": "І полетіла далі."}
      ],
      "characters": ["grandpa", "lina"],
      "visual_notes": "Кадр на безбарвний кущик, Ліна пролітає, морщиться і відвертається.",
      "beats": [
        {"t_rel": 0.0, "event": "Кущик у центрі"},
        {"t_rel": 2.0, "event": "Ліна пролітає й висловлює відразу"}
      ]
    },
    {
      "id": "SC04",
      "summary": "Жук Чмелик підходить до кущика, заспокоює його і доглядає, поки не починає розквітати.",
      "dialogue": [
        {"speaker": "grandpa", "text": "Але з-за куща вийшов Жук Чмелик."},
        {"speaker": "chmelyk", "text": "Ти не страшний. Ти просто ще не розкрився."},
        {"speaker": "grandpa", "text": "Він сидів поруч кілька днів, приніс крапельку роси, закрив від вітру."}
      ],
      "characters": ["grandpa", "chmelyk"],
      "visual_notes": "Чмелик ніжно обіймає кущ, приносить росу, захищає від вітру; кадр повільно змінюється від сірої гами до тепліших кольорів.",
      "beats": [
        {"t_rel": 0.0, "event": "Чмелик з’являється"},
        {"t_rel": 2.0, "event": "Обіймає кущ"},
        {"t_rel": 4.5, "event": "Приносить росу"}
      ]
    },
    {
      "id": "SC05",
      "summary": "Кущик розцвітає фіолетовою квіткою; Ліна повертається й дивується, визнає свою помилку.",
      "dialogue": [
        {"speaker": "grandpa", "text": "На третій день кущик розцвів – фіолетовою квіткою, яку ніхто ніколи не бачив."},
        {"speaker": "lina", "text": "Ого!"},
        {"speaker": "lina", "text": "Я ж думала, ти нецікавий…"},
        {"speaker": "chmelyk", "text": "А ти просто була занадто швидка, щоб помітити…"}
      ],
      "characters": ["grandpa", "lina", "chmelyk"],
      "visual_notes": "Фіолетова квітка розкривається, сяє; Ліна підлітає й дивується, Чмелик усміхається.",
      "beats": [
        {"t_rel": 0.0, "event": "Розкриття квітки", "emphasis": "reveal"},
        {"t_rel": 2.5, "event": "Ліна прилітає"},
        {"t_rel": 4.5, "event": "Діалог між Ліною та Чмеликом"}
      ]
    },
    {
      "id": "SC06",
      "summary": "Ліна просить Чмелика навчити її бачити повільно; з того часу вона іноді зупиняється і слухає.",
      "dialogue": [
        {"speaker": "lina", "text": "Навчи мене бачити повільно."},
        {"speaker": "grandpa", "text": "Відтоді Ліна не тільки літала – вона іноді зупинялась. І слухала."},
        {"speaker": "grandpa", "text": "Бо іноді найяскравіші речі розквітають у тиші."}
      ],
      "characters": ["grandpa", "lina", "chmelyk"],
      "visual_notes": "Ліна сідає поруч із квіткою та Чмеликом, усміхається, на екрані з’являються зірочки та сердечка як символи краси й тиші.",
      "beats": [
        {"t_rel": 0.0, "event": "Ліна сідає"},
        {"t_rel": 2.0, "event": "Пауза і тиша"},
        {"t_rel": 4.0, "event": "Висновок з мораллю"}
      ]
    }
  ]
}